{
  "id": "help",
  "title_fa": "راهنما",
  "entry": "q",
  "nodes": {
    "q": {
      "type": "menu",
      "text_fa": "راهنمای کدام بخش؟",
      "buttons": [
        [
          {
            "label_fa": "ثبت تست",
            "next": "h1"
          },
          {
            "label_fa": "کلید",
            "next": "h2"
          }
        ],
        [
          {
            "label_fa": "مرور",
            "next": "h3"
          },
          {
            "label_fa": "پیش‌بینی",
            "next": "h4"
          }
        ],
        [
          {
            "label_fa": "⬅️ برگشت",
            "next": "__back"
          },
          {
            "label_fa": "🏠 منوی اصلی",
            "flow": "menu"
          }
        ]
      ]
    },
    "h1": {
      "type": "message",
      "text_fa": "درس ← کتاب ← بازه ← پاسخ‌ها (۰ یعنی نزده) ← زمان حدودی. تمام.",
      "buttons": [
        [
          {
            "label_fa": "⬅️ برگشت",
            "next": "q"
          }
        ]
      ]
    },
    "h2": {
      "type": "message",
      "text_fa": "در صفحه کتاب، بازه را انتخاب کن و کلیدها را پشت هم تایپ کن (مثل ۳۱۴۲۲). تست‌های بدون کلید خودکار تصحیح می‌شوند.",
      "buttons": [
        [
          {
            "label_fa": "⬅️ برگشت",
            "next": "q"
          }
        ]
      ]
    },
    "h3": {
      "type": "message",
      "text_fa": "هر تست غلط، نزده یا حدسی وارد صف مرور می‌شود و برنامه زمان مرور بعدی را تعیین می‌کند.",
      "buttons": [
        [
          {
            "label_fa": "⬅️ برگشت",
            "next": "q"
          }
        ]
      ]
    },
    "h4": {
      "type": "message",
      "text_fa": "بودجه‌بندی آزمون را وارد کن تا درصد هر درس به‌صورت بازه و مباحث نزده و نخوانده نمایش داده شوند.",
      "buttons": [
        [
          {
            "label_fa": "⬅️ برگشت",
            "next": "q"
          }
        ]
      ]
    }
  },
  "version": "1.0"
}